<?xml version='1.0' encoding='UTF-8'?>
<!--<!DOCTYPE rodzaje SYSTEM "rodzaje.dtd">-->
    <rodzaje>
        <rodzaj podatek="0.05" nazwa="Sok"/>
        <rodzaj nazwa="Napój"/>
        <rodzaj podatek="0.23" nazwa="Napój_energetyczny"/>
        <rodzaj podatek="0.23" nazwa="Piwo"/>
        <rodzaj podatek="0.23" nazwa="Wódka"/>
        <rodzaj podatek="0.05" nazwa="Nektar"/>
        <rodzaj podatek="0.23" nazwa="Woda"/>
    </rodzaje>